{
  "$schema": "https://json-schema.org/draft/2020-12/schema",
  "$comment": "Generated by scripts/schemas from trialfolio.contracts.attempt.StartRecord, in serialization mode. Validation and serialization modes give the same schema. Never edit it by hand.",
  "$defs": {
    "Exchange": {
      "additionalProperties": false,
      "description": "One HTTP exchange the wrapper made through Trial Folio's transport adapter (HTTP\nexchanges). Nothing else about it is kept: no headers, tokens, bodies, or exceptions.",
      "properties": {
        "request": {
          "description": "The method and path, such as `POST /auth` or `POST /screen/backtest`.",
          "pattern": "^[A-Z]+ /[^\\s]*$",
          "title": "Request",
          "type": "string"
        },
        "result": {
          "enum": [
            "response",
            "not_connected",
            "interrupted"
          ],
          "title": "Result",
          "type": "string"
        },
        "status": {
          "anyOf": [
            {
              "maximum": 599,
              "minimum": 100,
              "type": "integer"
            },
            {
              "type": "null"
            }
          ],
          "description": "The HTTP status of a `response`; null otherwise.",
          "title": "Status"
        },
        "note": {
          "anyOf": [
            {
              "const": "completed_from_saved_response",
              "type": "string"
            },
            {
              "type": "null"
            }
          ],
          "description": "Set only on a restarted attempt's request exchange, recorded as a 200 because its response\nwas found saved (uncertain completion); null otherwise.",
          "title": "Note"
        }
      },
      "required": [
        "request",
        "result",
        "status",
        "note"
      ],
      "title": "Exchange",
      "type": "object"
    },
    "TransportVersions": {
      "additionalProperties": false,
      "description": "The installed `requests` and `urllib3`, which carry the wrapper's requests.",
      "properties": {
        "requests": {
          "pattern": "^[0-9][0-9A-Za-z.+!_-]*$",
          "title": "Requests",
          "type": "string"
        },
        "urllib3": {
          "pattern": "^[0-9][0-9A-Za-z.+!_-]*$",
          "title": "Urllib3",
          "type": "string"
        }
      },
      "required": [
        "requests",
        "urllib3"
      ],
      "title": "TransportVersions",
      "type": "object"
    },
    "WrapperVersions": {
      "additionalProperties": false,
      "description": "The installed `p123api`, which sends the requests (plan contents).",
      "properties": {
        "p123api": {
          "pattern": "^[0-9][0-9A-Za-z.+!_-]*$",
          "title": "P123Api",
          "type": "string"
        }
      },
      "required": [
        "p123api"
      ],
      "title": "WrapperVersions",
      "type": "object"
    }
  },
  "additionalProperties": false,
  "description": "The start record, written durably just before the request is sent. Without an attempt\nrecord beside it, the attempt is `running` (uncertain completion).",
  "properties": {
    "schema_version": {
      "const": "1.0.0",
      "title": "Schema Version",
      "type": "string"
    },
    "trialfolio_version": {
      "pattern": "^(0|[1-9][0-9]*)\\.(0|[1-9][0-9]*)\\.(0|[1-9][0-9]*)$",
      "title": "Trialfolio Version",
      "type": "string"
    },
    "attempt_id": {
      "format": "uuid4",
      "title": "Attempt Id",
      "type": "string"
    },
    "case_id": {
      "pattern": "^case-[0-9a-f]{16}$",
      "title": "Case Id",
      "type": "string"
    },
    "plan_hash": {
      "description": "The plan the attempt runs under.",
      "pattern": "^sha256:[0-9a-f]{64}$",
      "title": "Plan Hash",
      "type": "string"
    },
    "started_at": {
      "format": "date-time",
      "title": "Started At",
      "type": "string"
    },
    "provider_wrapper": {
      "$ref": "#/$defs/WrapperVersions"
    },
    "transport": {
      "$ref": "#/$defs/TransportVersions"
    },
    "exchanges": {
      "description": "The successful authentication exchange completed before the request in 0.1.0.",
      "maxItems": 1,
      "minItems": 1,
      "prefixItems": [
        {
          "$ref": "#/$defs/Exchange"
        }
      ],
      "title": "Exchanges",
      "type": "array"
    }
  },
  "required": [
    "schema_version",
    "trialfolio_version",
    "attempt_id",
    "case_id",
    "plan_hash",
    "started_at",
    "provider_wrapper",
    "transport",
    "exchanges"
  ],
  "title": "StartRecord",
  "type": "object"
}
